{
 "doc": "docs/2_PRD.md",
 "companions": [],
 "commit": "4523908",
 "inventory": "reports/direction/2026-10-26/inventory.json",
 "claims": [
  {
   "id": "D11",
   "kind": "rule",
   "section": "1, 16",
   "claim": "Intended use: decision support; NeoGold does not diagnose; every screen uses this framing.",
   "status": "Contradicted",
   "area": "clinical-wording",
   "milestone": "M3",
   "evidence": [
    {
     "file": "docs/2_PRD.md",
     "line": 20,
     "quote": "It does not diagnose and is not intended to be a medical device. Every screen, store text, and document uses this framing (D11)."
    },
    {
     "file": "android/feature/screening/src/main/kotlin/com/kitalonlabs/neogold/feature/screening/ui/S14RuleOutcomeScreen.kt",
     "line": 70,
     "quote": "Yellow discoloration in the first 24 hours of life indicates severe early hyperbilirubinemia."
    },
    {
     "file": "android/feature/screening/src/main/kotlin/com/kitalonlabs/neogold/feature/screening/ui/S14RuleOutcomeScreen.kt",
     "line": 65,
     "quote": "Clinical danger signs detected. Immediate emergency medical evaluation required."
    },
    {
     "file": "android/core/designsystem/src/main/res/values/strings.xml",
     "line": 72,
     "quote": "NeoGold provides decision support for trained health workers."
    }
   ],
   "reason": "Onboarding and About strings use the decision-support framing, but S14 shows hardcoded English reason lines that state a diagnosis ('indicates severe early hyperbilirubinemia'). These lines are not string resources and are not in the doc 6 reviewed wording."
  },
  {
   "id": "doc-4-1",
   "kind": "rule",
   "section": "4.1",
   "claim": "Lowest result is 'no further action from this screen; continue routine care and watch for danger signs'.",
   "status": "Contradicted",
   "area": "clinical-wording",
   "milestone": "M3",
   "evidence": [
    {
     "file": "android/app/src/main/kotlin/com/kitalonlabs/neogold/MainActivity.kt",
     "line": 594,
     "quote": "TriageUiAction.NO_FURTHER_ACTION -> \"Routine newborn care. Re-evaluate if jaundice deepens.\""
    },
    {
     "file": "android/core/designsystem/src/main/res/values/strings.xml",
     "line": 7,
     "quote": "<string name=\"next_no_further\">Continue routine care. Watch for danger signs.</string>"
    }
   ],
   "reason": "The header uses action_no_further correctly. But the next-step line passed to S20 is a hardcoded English literal, not next_no_further, and it drops 'watch for danger signs'. Not localized."
  },
  {
   "id": "doc-4-2",
   "kind": "rule",
   "section": "4.2",
   "claim": "Every uncertainty (bad image, borderline value, unsupported device, missing input) resolves toward a blood test.",
   "status": "Partial",
   "area": "triage",
   "milestone": "M3",
   "evidence": [
    {
     "file": "android/engine/triage/src/main/kotlin/com/kitalonlabs/neogold/engine/triage/TriageEngine.kt",
     "line": 176,
     "quote": "if (uTenths - lTenths > maxWidthTenths) { ... BLOOD_TEST_TODAY, WIDE_INTERVAL"
    },
    {
     "file": "android/engine/triage/src/main/kotlin/com/kitalonlabs/neogold/engine/triage/TriageEngine.kt",
     "line": 112,
     "quote": "if (inputs.qualityFailedAttempts >= 3) { ... BLOOD_TEST_TODAY"
    }
   ],
   "reason": "The engine routes wide intervals and quality failures toward a blood test. The app does not use it: S07 always reports QUALIFIED, S16 skips the quality gate, and S19 sets a constant NO_FURTHER_ACTION (see FR-04, FR-13, FR-20)."
  },
  {
   "id": "doc-4-4",
   "kind": "rule",
   "section": "4.4",
   "claim": "Clinical red flags (jaundice under 24 h, danger signs) trigger urgent referral before the model runs.",
   "status": "Implemented",
   "area": "triage",
   "milestone": "M1",
   "evidence": [
    {
     "file": "android/engine/triage/src/main/kotlin/com/kitalonlabs/neogold/engine/triage/TriageEngine.kt",
     "line": 61,
     "quote": "// Step 2: Hard rules in strict order R1 to R5 (first match wins)"
    },
    {
     "file": "android/app/src/main/kotlin/com/kitalonlabs/neogold/MainActivity.kt",
     "line": 407,
     "quote": "if (isEarlyJaundice) { sessionRuleOutcome = TriageReasonCode.R2; navigate(S14_RULE_OUTCOME)"
    }
   ],
   "reason": "Both the engine and the app's pre-camera path route red flags to REFER_URGENT before capture. TC-TRI tests exist."
  },
  {
   "id": "doc-4-5",
   "kind": "rule",
   "section": "4.5",
   "claim": "Screening mode does not keep images unless in a consented research session.",
   "status": "Implemented",
   "area": "privacy",
   "milestone": "M3",
   "evidence": [
    {
     "file": "android/feature/screening/src/main/kotlin/com/kitalonlabs/neogold/feature/screening/domain/ScreeningPipelineUseCase.kt",
     "line": 82,
     "quote": "fun execute(frame: ImageFrame, cardBatch: CardBatchPayload, ..."
    },
    {
     "inventory_key": "categories.test_cases.details.tests_per_tc",
     "quote": "TC-PRIV-01..05 have 1 to 6 tests each"
    }
   ],
   "reason": "The pipeline works on in-memory ImageFrame. The screening UI has no file writes."
  },
  {
   "id": "doc-4-6",
   "kind": "rule",
   "section": "4.6",
   "claim": "Honest about evidence: the app shows which model version and validation population it was built on.",
   "status": "Contradicted",
   "area": "clinical-wording",
   "milestone": "M2",
   "evidence": [
    {
     "file": "android/feature/settings/src/main/kotlin/com/kitalonlabs/neogold/feature/settings/S24AboutScreen.kt",
     "line": 124,
     "quote": "Data sources: Multicenter prospective observational validation study data."
    },
    {
     "file": "MODEL_CARD.md",
     "line": 19,
     "quote": "This model was trained on calibrated synthetic bench phantoms ... It has NO CLINICAL MEANING"
    }
   ],
   "reason": "The app says the model came from validation-study data. The shipped model is a synthetic bench model and no study has started (A2)."
  },
  {
   "id": "J2-3",
   "kind": "rule",
   "section": "6 J2.3",
   "claim": "Rule outcomes: 'Refer urgently now'; 'NeoGold cannot screen this baby; use a blood test'; 'Jaundice after two weeks needs a doctor's review'.",
   "status": "Implemented",
   "area": "clinical-wording",
   "milestone": "M3",
   "evidence": [
    {
     "file": "android/core/designsystem/src/main/res/values/strings.xml",
     "line": 10,
     "quote": "NeoGold cannot screen this baby. Use a blood test."
    },
    {
     "file": "android/core/designsystem/src/main/res/values/strings.xml",
     "line": 172,
     "quote": "Jaundice after two weeks needs a doctor's review for other causes."
    }
   ],
   "reason": "S14 shows these via string resources. The extra hardcoded reason lines are reported under D11."
  },
  {
   "id": "J3-card",
   "kind": "screen",
   "section": "6 J3",
   "claim": "Result screen adds a 'What to tell the mother' card with simple Bangla script.",
   "status": "Implemented",
   "area": "clinical-wording",
   "milestone": "M3",
   "evidence": [
    {
     "file": "android/feature/result/src/main/kotlin/com/kitalonlabs/neogold/feature/result/S20ResultScreen.kt",
     "line": 121,
     "quote": "if (triageEnabled) { WhatToTellTheMotherCard(action = action, ..."
    }
   ],
   "reason": "mother_card_* strings exist in values and values-bn. TC-UI-09 has 1 test."
  },
  {
   "id": "J3-audio",
   "kind": "other",
   "section": "6 J3",
   "claim": "Audio playback option for the mother card.",
   "status": "Deferred",
   "area": "other",
   "milestone": "v1.x",
   "evidence": [],
   "reason": "The doc marks it Could-have: 'an audio playback option (Could-have)'. No audio code was found."
  },
  {
   "id": "FR-01",
   "kind": "FR",
   "section": "7.1",
   "claim": "Language selection (Bangla, English) at first launch and in settings.",
   "status": "Partial",
   "area": "other",
   "milestone": "M2",
   "evidence": [
    {
     "file": "android/app/src/main/kotlin/com/kitalonlabs/neogold/MainActivity.kt",
     "line": 269,
     "quote": "dataStore.setLanguage(lang)"
    }
   ],
   "reason": "S01 and S23 store the choice. Nothing applies it: no setApplicationLocales, LocaleManager or createConfigurationContext anywhere in src/main, so the UI follows the system locale."
  },
  {
   "id": "FR-02",
   "kind": "FR",
   "section": "7.1",
   "claim": "Mandatory safety notice with acknowledgment; re-shown after each major model update.",
   "status": "Partial",
   "area": "clinical-wording",
   "milestone": "M2",
   "evidence": [
    {
     "file": "android/app/src/main/kotlin/com/kitalonlabs/neogold/MainActivity.kt",
     "line": 282,
     "quote": "dataStore.setSafetyAckVersion(1)"
    },
    {
     "file": "android/app/src/main/kotlin/com/kitalonlabs/neogold/MainActivity.kt",
     "line": 224,
     "quote": "startDestination: String = Destinations.S01_LANGUAGE,"
    }
   ],
   "reason": "S02 to S04 with 'I understand' exist. The ack version is a constant 1 and is never compared to the model version. onboardingComplete is never read, so onboarding restarts at S01 on every launch."
  },
  {
   "id": "FR-03",
   "kind": "FR",
   "section": "7.1",
   "claim": "Device check: memory, camera controls (optional), brand-specific battery guidance.",
   "status": "Implemented",
   "area": "other",
   "milestone": "M1",
   "evidence": [
    {
     "file": "android/feature/onboarding/src/main/kotlin/com/kitalonlabs/neogold/feature/onboarding/S05DeviceCheckScreen.kt",
     "line": 61,
     "quote": "report ?: DeviceChecker.checkDevice(context)"
    }
   ],
   "reason": "DeviceChecker and DeviceBatteryGuidance are in :engine:camera. TC-DEV-01..10 have tests."
  },
  {
   "id": "FR-04",
   "kind": "FR",
   "section": "7.1",
   "claim": "Per-device camera qualification (repeatability, uniformity, accuracy); fail limits to research; re-run every 30 days or OS update.",
   "status": "Partial",
   "area": "quality-gate",
   "milestone": "M1",
   "evidence": [
    {